{
  "extends": ["@parcel/config-default"],
  "transformers": {
    "types:*.{ts,tsx}": ["@parcel/transformer-typescript-types"],
    "bundle-text:*": ["@parcel/transformer-inline-string", "..."],
    "data-url:*": ["@parcel/transformer-inline-string", "..."],
    "*.worker.{js,mjs,jsm,jsx,es6,ts,tsx}": [
      "@parcel/transformer-workerize",
      "..."
    ],
    "*.{js,mjs,jsm,jsx,es6,ts,tsx}": [
      "@parcel/transformer-sync-dynamic-import",
      "@parcel/transformer-babel",
      "@parcel/transformer-js"
    ],
    "*.{json,json5}": ["@parcel/transformer-json"],
    "*.toml": ["@parcel/transformer-toml"],
    "*.yaml": ["@parcel/transformer-yaml"],
    "*.{gql,graphql}": ["@parcel/transformer-graphql"],
    "*.{styl,stylus}": ["@parcel/transformer-stylus"],
    "*.{sass,scss}": ["@parcel/transformer-sass"],
    "*.less": ["@parcel/transformer-less"],
    "*.css": ["@parcel/transformer-postcss", "@parcel/transformer-css"],
    "*.sss": ["@parcel/transformer-sugarss"],
    "*.{htm,html}": [
      "@parcel/transformer-posthtml",
      "@parcel/transformer-html"
    ],
    "*.pug": ["@parcel/transformer-pug"],
    "*.coffee": ["@parcel/transformer-coffeescript"],
    "*.mdx": ["@parcel/transformer-mdx"],
    "*.{eot,gif,jpg,jpeg,ico,mp4,png,svg,ttf,woff}": [
      "@parcel/transformer-raw"
    ],
    "url:*": ["@parcel/transformer-raw"],
    "*": ["@parcel/transformer-not-splittable"]
  },
  "reporters": [
    "@atlassian/parcel-reporter-analytics",
    "@parcel/reporter-manifest",
    "@parcel/reporter-dev-server",
    "@parcel/reporter-bundle-analyzer"
  ],
  "resolvers": ["@parcel/resolver-atlassian-ssr"]
}
